{
 "schema": "cmfsim-case/1",
 "name": "surrogate_well",
 "description": "Trecho «well» do sistema offshore (Tabela 21) isolado, fluido da Tabela 6, não escorregamento; entrada no centro das faixas da Tabela 27 (§5.7).",
 "fluid": {
  "type": "compositional",
  "components": [
   {
    "id": "CO2",
    "z": 0.009,
    "MW": 44.0,
    "Pc": 7370000.0,
    "Tc": 304.1,
    "omega": 0.2389,
    "Tb": 194.5,
    "Hf": -393790000.0,
    "cp": [
     5.457,
     0.001045,
     0.0,
     -115700.0
    ],
    "Nc_eff": 1.0
   },
   {
    "id": "N2",
    "z": 0.007,
    "MW": 28.0,
    "Pc": 3390000.0,
    "Tc": 126.2,
    "omega": 0.04,
    "Tb": 77.3,
    "Hf": 0.0,
    "cp": [
     3.28,
     0.000593,
     0.0,
     4000.0
    ],
    "Nc_eff": 1.0
   },
   {
    "id": "H2S",
    "z": 0.001,
    "MW": 34.1,
    "Pc": 8960000.0,
    "Tc": 373.5,
    "omega": 0.094,
    "Tb": 212.8,
    "Hf": -20630000.0,
    "cp": [
     3.931,
     0.00149,
     0.0,
     -23200.0
    ],
    "Nc_eff": 1.0
   },
   {
    "id": "C1",
    "z": 0.384,
    "MW": 16.0,
    "Pc": 4600000.0,
    "Tc": 190.6,
    "omega": 0.012,
    "Tb": 111.4,
    "Hf": -74900000.0,
    "cp": [
     1.702,
     0.009081,
     -2.164e-06,
     0.0
    ],
    "Nc_eff": 1.0
   },
   {
    "id": "C2",
    "z": 0.016,
    "MW": 30.1,
    "Pc": 4880000.0,
    "Tc": 305.4,
    "omega": 0.0986,
    "Tb": 184.6,
    "Hf": -84738000.0,
    "cp": [
     1.131,
     0.019225,
     -5.561e-06,
     0.0
    ],
    "Nc_eff": 2.0
   },
   {
    "id": "C3",
    "z": 0.026,
    "MW": 44.1,
    "Pc": 4250000.0,
    "Tc": 369.8,
    "omega": 0.152,
    "Tb": 231.1,
    "Hf": -103890000.0,
    "cp": [
     1.213,
     0.028785,
     -8.824e-06,
     0.0
    ],
    "Nc_eff": 3.0
   },
   {
    "id": "nC4",
    "z": 0.03,
    "MW": 58.1,
    "Pc": 3800000.0,
    "Tc": 425.1,
    "omega": 0.2,
    "Tb": 272.7,
    "Hf": -126190000.0,
    "cp": [
     1.935,
     0.036915,
     -1.1402e-05,
     0.0
    ],
    "Nc_eff": 4.0
   },
   {
    "id": "nC5",
    "z": 0.026,
    "MW": 72.2,
    "Pc": 3370000.0,
    "Tc": 469.7,
    "omega": 0.252,
    "Tb": 309.2,
    "Hf": -146490000.0,
    "cp": [
     2.464,
     0.045351,
     -1.4111e-05,
     0.0
    ],
    "Nc_eff": 5.0
   },
   {
    "id": "nC6",
    "z": 0.024,
    "MW": 86.2,
    "Pc": 3030000.0,
    "Tc": 507.9,
    "omega": 0.3007,
    "Tb": 341.9,
    "Hf": -167290000.0,
    "cp": [
     3.025,
     0.053722,
     -1.6791e-05,
     0.0
    ],
    "Nc_eff": 6.0
   },
   {
    "id": "nC7",
    "z": 0.034,
    "MW": 100.2,
    "Pc": 2740000.0,
    "Tc": 540.2,
    "omega": 0.35,
    "Tb": 371.6,
    "Hf": -187890000.0,
    "cp": [
     3.57,
     0.062127,
     -1.9486e-05,
     0.0
    ],
    "Nc_eff": 7.0
   },
   {
    "id": "nC8",
    "z": 0.443,
    "MW": 114.2,
    "Pc": 2490000.0,
    "Tc": 568.7,
    "omega": 0.4,
    "Tb": 398.8,
    "Hf": -208590000.0,
    "cp": [
     4.108,
     0.070567,
     -2.2208e-05,
     0.0
    ],
    "Nc_eff": 8.0
   }
  ],
  "kij": "zero",
  "eos": {
   "type": "peng_robinson",
   "constants": "thesis"
  }
 },
 "pipe": {
  "profile": [
   {
    "x": 0.0,
    "D": 0.127,
    "roughness": 0.0002,
    "angle_deg": 90.0,
    "U": 7.0,
    "T_amb": 313.15
   },
   {
    "x": 1500.0
   }
  ]
 },
 "boundary": {
  "inlet": {
   "P": 16500000.0,
   "T": 353.15,
   "m": 13.5
  }
 },
 "model": {
  "type": "noslip",
  "friction": "homogeneous",
  "derivatives": "autodiff",
  "regime": {
   "regime": "automatic"
  }
 },
 "solver": {
  "type": "march",
  "integrator": "rk45",
  "rtol": 1e-07,
  "atol": 1e-07,
  "first_step": 5.0,
  "backend": "jax"
 },
 "outputs": {
  "dx_out": 150.0
 },
 "meta": {
  "source": "dissertação §5.7 (Tabelas 21, 27–29); amostras do autor no Apêndice B",
  "segment": "well"
 }
}
