{
 "schema": "cmfsim-case/1",
 "name": "offshore_5_5_noslip",
 "description": "Sistema offshore (§5.5): poço 1500 m vertical, linha 6000 m horizontal, riser 300 m vertical; fluido da Tabela 19 com C7+; 170 bar, 80 °C, 10 kg/s; modelo de não escorregamento por marcha.",
 "fluid": {
  "type": "compositional",
  "components": [
   {
    "id": "CO2",
    "z": 0.007,
    "MW": 44.0,
    "Pc": 7370000.0,
    "Tc": 304.1,
    "omega": 0.2389,
    "Tb": 194.5,
    "Hf": -393790000.0,
    "cp": [
     5.457,
     0.001045,
     0.0,
     -115700.0
    ],
    "Nc_eff": 1.0
   },
   {
    "id": "N2",
    "z": 0.011,
    "MW": 28.0,
    "Pc": 3390000.0,
    "Tc": 126.2,
    "omega": 0.04,
    "Tb": 77.3,
    "Hf": 0.0,
    "cp": [
     3.28,
     0.000593,
     0.0,
     4000.0
    ],
    "Nc_eff": 1.0
   },
   {
    "id": "C1",
    "z": 0.696,
    "MW": 16.0,
    "Pc": 4600000.0,
    "Tc": 190.6,
    "omega": 0.012,
    "Tb": 111.4,
    "Hf": -74900000.0,
    "cp": [
     1.702,
     0.009081,
     -2.164e-06,
     0.0
    ],
    "Nc_eff": 1.0
   },
   {
    "id": "C2",
    "z": 0.103,
    "MW": 30.1,
    "Pc": 4880000.0,
    "Tc": 305.4,
    "omega": 0.0986,
    "Tb": 184.6,
    "Hf": -84738000.0,
    "cp": [
     1.131,
     0.019225,
     -5.561e-06,
     0.0
    ],
    "Nc_eff": 2.0
   },
   {
    "id": "C3",
    "z": 0.049,
    "MW": 44.1,
    "Pc": 4250000.0,
    "Tc": 369.8,
    "omega": 0.152,
    "Tb": 231.1,
    "Hf": -103890000.0,
    "cp": [
     1.213,
     0.028785,
     -8.824e-06,
     0.0
    ],
    "Nc_eff": 3.0
   },
   {
    "id": "nC4",
    "z": 0.032,
    "MW": 58.1,
    "Pc": 3800000.0,
    "Tc": 425.1,
    "omega": 0.2,
    "Tb": 272.7,
    "Hf": -126190000.0,
    "cp": [
     1.935,
     0.036915,
     -1.1402e-05,
     0.0
    ],
    "Nc_eff": 4.0
   },
   {
    "id": "nC5",
    "z": 0.022,
    "MW": 72.2,
    "Pc": 3370000.0,
    "Tc": 469.7,
    "omega": 0.252,
    "Tb": 309.2,
    "Hf": -146490000.0,
    "cp": [
     2.464,
     0.045351,
     -1.4111e-05,
     0.0
    ],
    "Nc_eff": 5.0
   },
   {
    "id": "nC6",
    "z": 0.007,
    "MW": 86.2,
    "Pc": 3030000.0,
    "Tc": 507.9,
    "omega": 0.3007,
    "Tb": 341.9,
    "Hf": -167290000.0,
    "cp": [
     3.025,
     0.053722,
     -1.6791e-05,
     0.0
    ],
    "Nc_eff": 6.0
   },
   {
    "id": "C7plus",
    "z": 0.073,
    "MW": 560.0,
    "Pc": 837900.0,
    "Tc": 991.4,
    "omega": 1.32,
    "Tb": 841.9,
    "Hf": -572880000.0,
    "cp": [
     21.4,
     0.34,
     -0.0001086,
     0.0
    ],
    "Nc_eff": 20.0
   }
  ],
  "kij": "zero",
  "eos": {
   "type": "peng_robinson",
   "constants": "thesis"
  }
 },
 "pipe": {
  "profile": [
   {
    "x": 0.0,
    "D": 0.127,
    "roughness": 0.0002,
    "angle_deg": 90.0,
    "U": 7.0,
    "T_amb": 313.15
   },
   {
    "x": 1500.0,
    "D": 0.1524,
    "roughness": 0.0006,
    "angle_deg": 0.0,
    "U": 5.0,
    "T_amb": 285.15
   },
   {
    "x": 7500.0,
    "D": 0.1524,
    "roughness": 0.0006,
    "angle_deg": 90.0,
    "U": 5.0,
    "T_amb": 285.15
   },
   {
    "x": 7800.0
   }
  ]
 },
 "boundary": {
  "inlet": {
   "P": 17000000.0,
   "T": 353.15,
   "m": 10.0
  }
 },
 "model": {
  "type": "noslip",
  "friction": "homogeneous",
  "derivatives": "autodiff",
  "regime": {
   "regime": "automatic"
  }
 },
 "solver": {
  "type": "march",
  "integrator": "rk45",
  "rtol": 1e-07,
  "atol": 1e-07,
  "first_step": 5.0,
  "backend": "jax"
 },
 "outputs": {
  "dx_out": 50.0
 },
 "meta": {
  "source": "dissertação §5.5, Tabelas 19–22; alvos: Figuras 32–37 (references/figures/data/fig_32..37.json)"
 }
}
